level_0,index,word,sentence,context,wc,surprisal,top_pred_1830,top_pred_1840,top_pred_1850,top_pred_1860,top_pred_1870,top_pred_1880,top_pred_1890,top_pred_1900,top_pred_1910,top_pred_1920,top_pred_1930,top_pred_1940,top_pred_1950,top_pred_1960,top_pred_1970,top_pred_1980,top_pred_1990
695,597,basketball,"// still , basketball","// still ,",1031,tensor(10.5569),the,that,and,and,the,and,and,the,the,the,the,but,the,the,the,the,the
1335,14156,online,a california judge ruled march 11 that three independent online,a california judge ruled march 11 that three independent,1285,tensor(10.5480),states,nations,states,states,men,votes,states,states,states,judges,states,judges,judges,judges,state,federal,jurors
168,8591,2001,<p> the group enhanced its reputation with 2001,<p> the group enhanced its reputation with,1597,tensor(10.5402),the,the,the,the,the,the,the,the,a,the,the,the,the,its,the,the,the
2023,23510,radio,arc'teryx sidewinder sv jacket $450 800-985-6681 ; arcteryx.com smart touches a radio,arc'teryx sidewinder sv jacket $450 800-985-6681 ; arcteryx.com smart touches a,1996,tensor(10.5382),little,large,copy,la,new,new,young,little,little,pair,new,man,new,button,man,woman,$@@
648,833,basketball,"<p> now , warkenthien is the center of a story that has gripped basketball","<p> now , warkenthien is the center of a story that has gripped",1031,tensor(10.5174),out,its,the,the,the,the,out,the,me,the,the,the,the,the,the,the,the
1171,27097,movie,"you call an escort service , they 're not about to send you a couple of movie","you call an escort service , they 're not about to send you a couple of",2412,tensor(10.5048),horses,hours,hours,miles,horses,letters,days,hundred,horses,hundred,miles,weeks,days,hundred,hundred,hundred,messages
2228,21474,television,but it is lagging in television,but it is lagging in,1897,tensor(10.4815),the,the,the,the,the,the,the,the,the,the,the,the,the,the,the,the,the
1975,16110,programs,"for a long period , i swore off school-both as a teacher and teachee-until recently , when i noted in a catalog that my alma mater was offering some evening extension courses described as "" personal fulfillment programs","for a long period , i swore off school-both as a teacher and teachee-until recently , when i noted in a catalog that my alma mater was offering some evening extension courses described as "" personal fulfillment",1718,tensor(10.4703),",",of,.,",",",",.,.,.,of,.,.,.,.,"""",.,.,.
615,896,basketball,"<p> what she did n't say , though and what became fodder for prep web sites and the girls basketball","<p> what she did n't say , though and what became fodder for prep web sites and the girls",1031,tensor(10.4648),",",",",were,",",was,',',and,who,',',',',',',','
404,4619,anymore,"hopefully , we 've instilled in a lot teams in the nfc east that this is just not a game you can automatically call a win on your schedule anymore","hopefully , we 've instilled in a lot teams in the nfc east that this is just not a game you can automatically call a win on your schedule",1565,tensor(10.4446),.,.,.,.,.,train,.,.,.,.,.,.,.,.,.,.,.
1239,35783,okay,its okay,its,2571,tensor(10.4420),own,own,own,course,own,own,own,own,own,own,own,own,own,own,own,way,own
1500,6648,parking,"<p> recently , after parking","<p> recently , after",1156,tensor(10.4375),a,the,the,a,the,the,a,the,the,a,a,a,a,a,a,a,a
2233,21342,television,"paramount eventually turned to frank darabont , who wrote not only the shawshank redemption and the green mile but a number of installments of the young indiana jones chronicles television","paramount eventually turned to frank darabont , who wrote not only the shawshank redemption and the green mile but a number of installments of the young indiana jones chronicles",1897,tensor(10.4035),the,",",",",the,",",",",.,the,of,",",.,.,",",.,.,.,.
273,10235,2002,"nike , with 2002","nike , with",1440,tensor(10.3857),the,the,a,a,a,a,a,a,a,a,the,a,a,a,a,a,a
70,7343,1999,and three more from ... neko case 1 the lilys the 3-way 1999,and three more from ... neko case 1 the lilys the 3-way,1211,tensor(10.3808),to,",",",",to,",",",",to,to,is,",",.,.,mark,mark,mark,.,","
1397,14549,online,that was as far as my online,that was as far as my,1285,tensor(10.3723),own,observation,own,observation,knowledge,eyes,own,eye,eyes,own,heart,mind,father,father,father,home,mind
939,19273,global,despite the screaming global,despite the screaming,1654,tensor(10.3412),crew,of,of,of,of,of,of,of,of,of,wind,and,of,of,and,",",","
487,5345,anymore,""" in is ... not in anymore",""" in is ... not in",1565,tensor(10.3102),the,the,the,the,the,the,the,the,the,the,the,the,the,the,the,the,the
2248,20303,television,"lately , he 'd been looking for television","lately , he 'd been looking for",1897,tensor(10.2909),a,a,you,you,a,you,you,you,a,a,a,a,a,a,a,a,a
1288,36419,okay,"but interestingly , the first UNK initial stirring is is it okay","but interestingly , the first UNK initial stirring is is it",2571,tensor(10.2801),not,not,not,?,not,not,not,not,not,not,not,not,not,?,not,not,not
1746,40098,photo,it 's not a photo,it 's not a,2780,tensor(10.2739),matter,bad,little,good,bad,question,question,bad,bad,bad,question,question,bad,good,bad,good,matter
2287,21348,television,expanded to television,expanded to,1897,tensor(10.2731),the,the,the,the,the,the,the,the,the,a,the,the,the,the,the,the,the
679,885,basketball,by katherine dillin love and basketball,by katherine dillin love and,1031,tensor(10.2610),the,the,the,marriage,the,the,love,other,the,i,the,the,the,the,love,the,the
949,19344,global,they were seeking my help in calling wide attention to an emerging problem that i was just beginning to understand-global,they were seeking my help in calling wide attention to an emerging problem that i was just beginning to understand,1654,tensor(10.2591),.,.,.,.,.,.,.,.,.,.,.,.,.,.,.,.,.
890,12741,environmental,it often also takes environmental,it often also takes,1277,tensor(10.2293),its,the,a,a,the,a,a,the,the,a,a,a,a,a,a,a,a
1165,25662,movie,"there was no mistaking what was on her mind , so i paused the movie","there was no mistaking what was on her mind , so i paused the",2412,tensor(10.2035),moment,moment,moment,moment,moment,moment,moment,moment,moment,moment,moment,instant,moment,moment,moment,moment,moment
308,2108,2004,through at least 2004,through at least,1336,tensor(10.1994),a,two,one,one,a,a,a,a,one,a,a,a,a,one,a,one,one
2268,20688,television,<p> but then i thought about it : it 's not like surprises are necessary to my television,<p> but then i thought about it : it 's not like surprises are necessary to my,1897,tensor(10.1882),mind,purpose,mind,mind,fancy,taste,own,mind,going,own,father,friends,mother,mind,own,own,own
218,10581,2002,"the blur building , as it 's called , will be built offshore on switzerland 's lake neuchatel for the national expo 2002","the blur building , as it 's called , will be built offshore on switzerland 's lake neuchatel for the national expo",1440,tensor(10.1858),",",.,',',.,.,.,",",.,?,.,tion,?,67,.,.,.
965,19699,global,"its basic unit of classification , however , is not a word but a set of global","its basic unit of classification , however , is not a word but a set of",1654,tensor(10.1812),words,ideas,principles,ideas,facts,ideas,words,principles,rules,rules,features,rules,categories,words,rules,rules,criteria
2171,13432,sidebar,a dead heat-for now sidebar,a dead heat-for now,681,tensor(10.1517),",",",",",",",",",",",",",",",",.,.,.,.,.,.,.,.,.
472,5753,anymore,who knew anymore,who knew,1565,tensor(10.1004),that,the,her,that,the,him,the,the,her,how,the,the,the,the,what,what,the
2283,20322,television,UNK public relations staff launched hanauer on a day-long media blitz designed to lead the television,UNK public relations staff launched hanauer on a day-long media blitz designed to lead the,1897,tensor(10.0786),way,way,way,enemy,army,enemy,young,world,army,public,world,world,u.s.,democratic,nation,nation,nation
1938,15527,programs,it starts with joliet catholic facing mount carmel in a matchup of programs,it starts with joliet catholic facing mount carmel in a matchup of,1718,tensor(10.0567),the,the,the,the,the,the,the,the,the,the,the,the,the,the,the,the,the
1592,7048,parking,"even in the deepening twilight , the driving directions she 'd printed off the internet were simple to follow and a parking","even in the deepening twilight , the driving directions she 'd printed off the internet were simple to follow and a",1156,tensor(9.9917),few,few,few,new,light,few,few,little,few,little,little,little,few,few,few,few,few
1413,32362,onto,"// <p> @x for years nutritional scientists talked up dietary fiber as the key to better health , and now they are onto","// <p> @x for years nutritional scientists talked up dietary fiber as the key to better health , and now they are",3937,tensor(9.9866),so,not,all,so,all,all,able,not,all,in,able,in,making,in,beginning,not,eating
274,10824,2002,"<p> ira limit increases : the maximum annual individual retirement account contribution , which had been set at $2,000 for the last 20 years , is raised as follows : years 2002","<p> ira limit increases : the maximum annual individual retirement account contribution , which had been set at $2,000 for the last 20 years , is raised as follows : years",1440,tensor(9.9831),of,",",of,ago,of,",",after,of,",",ago,of,of,of,of,ago,of,of
2236,21792,television,"all those gathered here have an UNK buggerin ' bobby bales , who stands back against the far wall though the nobody in the congregation dares venture into his sightline of the television","all those gathered here have an UNK buggerin ' bobby bales , who stands back against the far wall though the nobody in the congregation dares venture into his sightline of the",1897,tensor(9.9760),city,poor,road,church,church,old,public,world,night,house,crowd,house,woods,church,city,night,world
2277,21755,television,dominique was a successful young television,dominique was a successful young,1897,tensor(9.9748),man,man,man,man,man,man,man,man,man,man,man,man,man,man,man,woman,man
1739,37428,photo,then it served yeoman duty as the photo,then it served yeoman duty as the,2780,tensor(9.9616),most,best,representative,only,best,best,best,chief,"""",most,chief,chief,first,first,chief,leader,president
222,11399,2002,statistical analysis of time and rainfall on mosquito counts <p> essentially there is no difference between the preconstruction and postconstruction periods when the preconstruction period is defined as 2000-2001 and the postconstruction period as 2002,statistical analysis of time and rainfall on mosquito counts <p> essentially there is no difference between the preconstruction and postconstruction periods when the preconstruction period is defined as 2000-2001 and the postconstruction period as,1440,tensor(9.9459),the,it,the,a,compared,the,a,the,the,the,the,the,a,the,a,the,the
1562,6901,parking,"how are decisions made about who is allocated new clients , assigned parking","how are decisions made about who is allocated new clients , assigned",1156,tensor(9.9097),to,to,to,to,to,to,to,to,to,to,to,to,to,to,to,to,to
560,4093,atlanta,"<p> * wesley dunn , house insurance committee chairman atlanta","<p> * wesley dunn , house insurance committee chairman",1360,tensor(9.9030),of,",",of,",",of,",",of,",",of,",",",",",",",",",",",",",",","
1046,3014,iraqi,we hear him UNK is another iraqi,we hear him UNK is another,835,tensor(9.8797),thing,name,name,instance,of,",",thing,",",thing,matter,man,.,thing,thing,matter,.,matter
978,20089,global,the fund-management firm barclays global,the fund-management firm barclays,1654,tensor(9.8680),",",",",",",",",",",",",",",.,",",",",",",",",",",",",with,the,","
549,3364,atlanta,as the atlanta,as the,1360,tensor(9.8554),first,sun,sun,most,man,most,sun,man,men,other,result,two,first,"""",first,first,first
1713,38616,photo,"i 'm so glad you 're here , "" she says after a photo","i 'm so glad you 're here , "" she says after a",2780,tensor(9.8442),few,pause,pause,moment,pause,moment,little,moment,minute,pause,moment,moment,moment,while,moment,moment,moment
494,4952,anymore,his often crotchety pronouncements as an elder statesman averred that the commercial theater simply had no room anymore,his often crotchety pronouncements as an elder statesman averred that the commercial theater simply had no room,1565,tensor(9.8407),for,for,for,for,for,for,for,in,for,for,for,for,for,for,for,for,for
564,4153,atlanta,payne looked down from his office on the derelict property and saw its potential to save atlanta from the embarrassment of playing host to the world UNK became atlanta,payne looked down from his office on the derelict property and saw its potential to save atlanta from the embarrassment of playing host to the world UNK became,1360,tensor(9.8357),a,a,a,the,a,a,a,a,a,a,a,a,a,a,a,a,a
1009,2900,iraqi,"some of these groups , they say , have been provided , usually through iraqi","some of these groups , they say , have been provided , usually through",835,tensor(9.8202),the,the,the,the,the,the,the,the,the,the,the,the,the,the,the,the,the
1250,36324,okay,pedrosa nods okay,pedrosa nods,2571,tensor(9.8012),",",",",",",",",",",",",and,",",his,",",.,.,and,.,",",.,.
1632,41589,phone,if it works and that is n't guaranteed your phone,if it works and that is n't guaranteed your,4790,tensor(9.7863),name,own,own,name,rights,rights,honor,vote,rights,own,life,life,goal,life,freedom,own,time
1993,15050,programs,burgeoning bureaucracies need think tanks to help them understand the programs,burgeoning bureaucracies need think tanks to help them understand the,1718,tensor(9.7732),word,matter,meaning,difference,meaning,nature,way,situation,situation,conditions,nature,nature,problems,problems,situation,problems,problems
1214,36303,okay,"so , to practice my skills , i started up a conversation with the pakistani guy whose name was fasid , and who forall i know is a terrorist , though he looked and talked like an okay","so , to practice my skills , i started up a conversation with the pakistani guy whose name was fasid , and who forall i know is a terrorist , though he looked and talked like an",2571,tensor(9.7702),old,old,old,old,old,angel,old,angel,old,old,old,old,american,indian,indian,idiot,idiot
926,19651,global,"<p> now , global","<p> now ,",1654,tensor(9.7552),and,i,and,and,and,and,and,and,and,i,i,in,the,in,the,in,the
1226,36333,okay,even 25-year-old stands of aspen and alder are okay,even 25-year-old stands of aspen and alder are,2571,tensor(9.7539),the,not,of,not,the,seen,the,the,the,the,the,.,the,the,in,now,the
326,1495,2004,and between 1991-when the company began a $60 million program to overhaul its entire supply chain-and 2004,and between 1991-when the company began a $60 million program to overhaul its entire supply chain-and,1336,tensor(9.7521),its,then,the,produce,to,to,its,its,the,to,to,other,thus,to,marketing,fuel,then
1125,26724,movie,the beach was being dosed down so some movie,the beach was being dosed down so some,2412,tensor(9.7449),time,of,distance,time,time,of,distance,distance,distance,of,of,of,of,of,people,of,of
1262,35667,okay,"and with all the events you 've scheduled "" "" we 'll get through the festival okay","and with all the events you 've scheduled "" "" we 'll get through the festival",2571,tensor(9.7378),",",",",",",",",",",",",",",",",",",",",.,",",",",",",.,",",","
1654,43933,phone,things were bleak before that phone,things were bleak before that,4790,tensor(9.7171),of,time,time,time,time,",",.,day,.,.,.,.,.,.,.,.,.
987,19289,global,yet global,yet,1654,tensor(9.7145),",",",",",",the,",",",",",",the,",",",",",",",",",",",",",",.,","
1115,24809,movie,their orchestrated job looked like the set of a men in black movie,their orchestrated job looked like the set of a men in black,2412,tensor(9.7145),",",",",coats,",",",",",",",",",",and,velvet,.,and,.,leather,uniforms,",",suits
1923,15793,programs,next to the frog was the remote control pad the saurs used to change programs,next to the frog was the remote control pad the saurs used to change,1718,tensor(9.7126),the,their,their,the,the,the,the,their,the,.,the,.,their,the,the,their,the
999,18723,global,the built-in global,the built-in,1654,tensor(9.6959),the,the,the,the,the,',',',",",the,',chair,mirror,system,"""",",",built-in
2272,20999,television,the chicago flower and garden show will feature lectures by pbs television,the chicago flower and garden show will feature lectures by pbs,1897,tensor(9.6562),",",.,.,and,",",and,and,",",and,.,and,club,and,.,and,and,and
5,7698,1999,"while many studies also found generally high bodsub5 effluent levels , some studies have found that UNK 1999","while many studies also found generally high bodsub5 effluent levels , some studies have found that UNK",1211,tensor(9.6519),the,the,the,",",the,",",the,the,the,the,the,the,the,.,.,the,","
1875,28243,program,the charter company knowledge is power program,the charter company knowledge is power,3642,tensor(9.6412),",",.,",",",",",",to,.,",",",",of,",",to,.,.,.,.,.
1928,15001,programs,"most of the females , young and old , buy programs","most of the females , young and old , buy",1718,tensor(9.6352),a,a,a,a,a,a,the,the,the,the,a,a,the,a,a,a,a
843,11926,environmental,"her company employs the "" triple bottom line , "" emphasizing environmental","her company employs the "" triple bottom line , "" emphasizing",1277,tensor(9.6270),"""",the,the,the,the,the,the,the,that,that,that,that,that,that,that,the,the
512,4210,atlanta,"not only is the weather bad here , but it 's raining in atlanta","not only is the weather bad here , but it 's raining in",1360,tensor(9.6018),the,the,the,the,the,the,the,the,the,the,the,the,the,the,the,the,the
1279,35297,okay,// my lady belongs here and so ... // okay,// my lady belongs here and so ... //,2571,tensor(9.5986),i,and,to,i,the,i,and,and,"""",i,i,"""","""",the,i,"""",""""
804,11963,environmental,some 50 million tons of rubble and waste along the gulf is yet another environmental,some 50 million tons of rubble and waste along the gulf is yet another,1277,tensor(9.5919),hundred,hundred,name,year,hundred,.,question,hundred,million,million,source,important,source,quarter,example,example,20
1870,30004,program,"understandably , and perhaps wisely , since she faces sentencing next month for vehicular homicide , kishline is now a sharp critic of the movement , dismissing it through her lawyer as a "" program","understandably , and perhaps wisely , since she faces sentencing next month for vehicular homicide , kishline is now a sharp critic of the movement , dismissing it through her lawyer as a """,3642,tensor(9.5817),a,spy,very,good,practical,prisoner,a,type,good,dangerous,crime,man,personal,phony,racist,dangerous,""""
820,12035,environmental,but the trees cut to make paper are only the first environmental,but the trees cut to make paper are only the first,1277,tensor(9.5812),to,to,of,to,of,of,ones,to,of,of,ones,of,ones,to,to,to,ones
1768,37406,photo,"<br> "" the photo","<br> "" the",2780,tensor(9.5730),first,"""","""",whole,"""","""","""","""","""",world,"""","""",united,"""","""",most,most
1096,2919,iraqi,it is true that major trading houses rushed into the iraqi,it is true that major trading houses rushed into the,835,tensor(9.5492),country,streets,country,streets,city,water,country,country,hands,market,market,country,market,market,market,market,market
1160,27040,movie,"no , you 'd need someone else as your father because the irish censors would be watching closely and you 'd be badly disappointed if the people in limerick , your city , and the rest of ireland were denied the opportunity of seeing the story of your miserable childhood and subsequent triumph as teacher and movie","no , you 'd need someone else as your father because the irish censors would be watching closely and you 'd be badly disappointed if the people in limerick , your city , and the rest of ireland were denied the opportunity of seeing the story of your miserable childhood and subsequent triumph as teacher and",2412,tensor(9.5445),friend,teacher,friend,friend,teacher,teacher,teacher,teacher,teacher,teacher,as,teacher,teacher,teacher,teacher,teacher,teacher
960,18866,global,"but the fresh-faced , pierced , maximally trendy global","but the fresh-faced , pierced , maximally trendy",1654,tensor(9.5425),",",",",",",",",",",",",",",",",of,",",girl,",",",",",",man,",",","
1635,40829,phone,she walked back into the kitchen and stared at the wall phone,she walked back into the kitchen and stared at the wall,4790,tensor(9.5383),.,",",.,.,.,.,.,.,.,.,.,.,.,.,.,.,.
985,19044,global,"we can not avoid reading back our powerful cosmopolitan present , the sense we have of our global","we can not avoid reading back our powerful cosmopolitan present , the sense we have of our",1654,tensor(9.5333),country,own,own,own,own,own,own,own,own,own,own,own,own,own,past,own,own
28,7715,1999,<p> going public ... <p> UNK 1999,<p> going public ... <p> UNK,1211,tensor(9.5332),",",of,of,",",the,",",",",",",",",<p>,<p>,<p>,<p>,<p>,.,.,the
879,12402,environmental,says city college of new york environmental,says city college of new york,1277,tensor(9.5090),",",",",",",",",",",",",",",",",",",",",city,",",university,.,",",.,city
336,1436,2004,"rackman remembered , now , that all the paper money had changed five or ten years back , new designs , bigger portraits , distinctive patches of pink or blue ink on their front sides that had once been boringly UNK date "" 2004","rackman remembered , now , that all the paper money had changed five or ten years back , new designs , bigger portraits , distinctive patches of pink or blue ink on their front sides that had once been boringly UNK date """,1336,tensor(9.5027),the,the,the,the,the,the,"""",the,the,of,the,"""",the,"""",and,),the
702,17990,billion,it 's the channel for a billion,it 's the channel for a,2039,tensor(9.4901),good,mile,good,little,man,man,ship,man,long,long,man,long,man,change,new,few,few
1094,2522,iraqi,28 <p> iraqi,28 <p>,835,tensor(9.4684),.,.,ck,ed,is,th,ts,.,.,new,the,the,the,the,the,the,the
857,12759,environmental,"the year 2005 saw the driest conditions in 40 years , with wildfires raging unabated , and 2006 is looking worse , raising alarms that environmental","the year 2005 saw the driest conditions in 40 years , with wildfires raging unabated , and 2006 is looking worse , raising alarms that",1277,tensor(9.4646),are,the,have,the,have,are,are,are,are,the,are,would,are,are,the,have,could
1855,30307,program,"the bears will be delivered to blue santa , a houston police department program","the bears will be delivered to blue santa , a houston police department",3642,tensor(9.4603),",",",",",",",",",",",",",",",",",",",",.,",",official,spokesman,spokesman,.,","
1795,38500,photo,<p> sep 26 : chicago chapter photo,<p> sep 26 : chicago chapter,2780,tensor(9.4509),xx@@,i.,iii,iii,xiii,i.,i,i.,i,.,of,1,5,<p>,of,of,11
306,1538,2004,after the tepid response to her 2004,after the tepid response to her,1336,tensor(9.4426),",",own,voice,voice,own,summons,voice,voice,call,husband,own,voice,own,distress,husband,husband,father
1016,2779,iraqi,"when the agency suggested another one of their studs , a very dark-skinned iraqi","when the agency suggested another one of their studs , a very dark-skinned",835,tensor(9.4296),",",animal,",",",",",",man,animal,man,young,man,man,man,man,man,",",man,","
381,2062,2004,"<p> meehan concluded by thanking the audience and expressing his pleasure in speaking with the second biggest cadre of public health practitioners - environmental health UNK meehan and introduced jim henderson from the anchorage convention bureau , to talk about anchorage , alaska , the site of nehas 2004","<p> meehan concluded by thanking the audience and expressing his pleasure in speaking with the second biggest cadre of public health practitioners - environmental health UNK meehan and introduced jim henderson from the anchorage convention bureau , to talk about anchorage , alaska , the site of nehas",1336,tensor(9.4277),",",",",",",",",been,",",",",been,been,",",",",been,",",",",",",been,.
1829,29439,program,<p> now that the sidewalk program,<p> now that the sidewalk,3642,tensor(9.4054),was,was,was,was,is,is,is,was,is,is,is,was,was,is,is,is,was
1659,43377,phone,but their efforts to put advanced technologies to work in ghana are often thwarted by the failings of much older infrastructure technologies-the phone,but their efforts to put advanced technologies to work in ghana are often thwarted by the failings of much older infrastructure technologies-the,4790,tensor(9.3923),most,want,same,most,more,effect,"""",theory,style,most,fact,fact,fact,french,fact,most,new
810,11736,environmental,"seven years later , at 12 , i became the youngest member of the environmental","seven years later , at 12 , i became the youngest member of the",1277,tensor(9.3920),church,family,society,society,family,family,family,family,family,family,group,family,family,family,national,team,american
207,10534,2002,<p> the 2002,<p> the,1440,tensor(9.3846),first,whole,other,first,world,same,king,most,day,new,president,new,first,new,new,first,man
558,3305,atlanta,it 's no secret that the atlanta,it 's no secret that the,1360,tensor(9.3828),old,young,devil,old,man,man,young,lord,man,world,president,germans,world,other,president,government,government
834,12679,environmental,"<p> high cancer rate , no clinic <p> the state studies attributed higher cancer rates partly to lifestyle factors such as cigarette smoking , diet and alcohol use , but did not rule out environmental","<p> high cancer rate , no clinic <p> the state studies attributed higher cancer rates partly to lifestyle factors such as cigarette smoking , diet and alcohol use , but did not rule out",1277,tensor(9.3791),of,of,of,of,the,of,of,the,the,of,the,the,the,the,the,the,the
