level_0,index,word,sentence,context,wc,surprisal,top_pred_1830,top_pred_1840,top_pred_1850,top_pred_1860,top_pred_1870,top_pred_1880,top_pred_1890,top_pred_1900,top_pred_1910,top_pred_1920,top_pred_1930,top_pred_1940,top_pred_1950,top_pred_1960,top_pred_1970,top_pred_1980,top_pred_1990
1308,14267,online,he suddenly envisioned himself returning all the furniture monica had ordered for him online,he suddenly envisioned himself returning all the furniture monica had ordered for him,1285,tensor(14.0762),to,",",",",.,.,to,.,.,.,.,.,.,.,.,.,.,.
2127,13026,sidebar,"this UNK integrity , family sidebar","this UNK integrity , family",681,tensor(13.6958),",",",",",",",",",",",",",",",",and,and,",",",",and,",",",",",",","
2161,13237,sidebar,the social turmoil of the 1960s and its attendant political pressures provided the impetus for the creation of think tanks that became sidebar,the social turmoil of the 1960s and its attendant political pressures provided the impetus for the creation of think tanks that became,681,tensor(13.6325),the,the,the,the,necessary,a,the,the,the,effective,the,obsolete,necessary,effective,the,the,the
921,19293,global,but i 'd call them emotional global,but i 'd call them emotional,1654,tensor(13.6247),",",",",",",",",.,beings,",",",",.,.,.,.,.,.,.,.,.
2039,24278,radio,"<p> "" it 's the kind of subject that , frankly , radio","<p> "" it 's the kind of subject that , frankly ,",1996,tensor(13.5639),is,i,i,i,is,is,is,is,is,is,is,seems,is,i,is,is,is
2177,12894,sidebar,"that 's because few devices , including the two-finger readers at disney world , sidebar","that 's because few devices , including the two-finger readers at disney world ,",681,tensor(13.4645),are,are,are,have,are,are,are,have,have,have,are,have,are,are,are,are,are
2344,22356,u.s.,grown-ups ,grown,675,tensor(13.3447),up,up,up,",",up,up,",",in,up,in,up,",",",",up,in,up,up
1061,3188,iraqi,"zaha hadid architect , uk after many years of praise and promise , but few executed designs , this year was iraqi","zaha hadid architect , uk after many years of praise and promise , but few executed designs , this year was",835,tensor(13.1769),the,the,a,the,a,the,the,the,the,the,the,the,a,the,the,the,a
581,4515,atlanta,""" atlanta","""",1360,tensor(13.0345),,,,,,,,,,,,,,,,,
2319,22324,u.s.,walking a few hundred yards off the beaten path really ups ,walking a few hundred yards off the beaten path really,675,tensor(13.0244),to,",",so,led,",",occupied,leads,meant,to,did,was,stopped,was,did,big,",",did
1980,15680,programs,<p> rating : 4 footballs : heavyweight programs,<p> rating : 4 footballs : heavyweight,1718,tensor(12.9854),",",",",of,;,",",.,;,",",",",champion,champion,",",title,champion,championship,champion,title
2003,24353,radio,"but the bigger the telescope , the more weak radio","but the bigger the telescope , the more weak",1996,tensor(12.9657),",",the,the,the,the,the,",",the,the,the,the,the,the,the,the,the,the
2155,12877,sidebar,"at the same time , the co-dependent is someone who needs to feel he or she is helping someone , and gains this feeling of making a difference to someone through sidebar","at the same time , the co-dependent is someone who needs to feel he or she is helping someone , and gains this feeling of making a difference to someone through",681,tensor(12.9462),the,the,the,the,whom,whom,the,whom,her,the,whom,whom,whom,whom,the,the,whom
1028,2583,iraqi,seldom have i witnessed much iraqi,seldom have i witnessed much,835,tensor(12.6797),of,of,of,of,of,of,of,of,of,of,of,of,of,of,of,of,of
578,3320,atlanta,"as far back as september , when the news had come that hood had pulled out and the union armies had atlanta","as far back as september , when the news had come that hood had pulled out and the union armies had",1360,tensor(12.6796),been,been,been,been,been,been,been,been,been,been,been,been,been,been,been,been,been
692,549,basketball,why put stipulations on basketball,why put stipulations on,1031,tensor(12.6247),the,the,the,the,the,the,the,the,the,the,the,the,the,the,the,the,the
2340,22123,u.s.,"the faces , open-mouthed , looked down at eliot , and the man in the ruffles nodded like a king and pointed at him and repeated , u.s.","the faces , open-mouthed , looked down at eliot , and the man in the ruffles nodded like a king and pointed at him and repeated ,",675,tensor(12.6198),"""","""","""","""","""","""","""","""","""","""","""","""","""","""","""","""",""""
249,11042,2002,better get the lights turned on before 2002,better get the lights turned on before,1440,tensor(12.5793),the,the,they,the,the,night,the,they,they,you,i,they,they,the,you,you,the
2031,24027,radio,"follow-up radiographs should generally be obtained at approximately 4-6 weeks , and contact sports and activities are restricted for approximately 2-3 weeks following clinical and radio","follow-up radiographs should generally be obtained at approximately 4-6 weeks , and contact sports and activities are restricted for approximately 2-3 weeks following clinical and",1996,tensor(12.5539),un@@,elaborate,irregular,un@@,similar,uniform,superficial,physical,clinical,technical,surgical,psychiatric,other,laboratory,surgical,medical,clinical
2355,22383,u.s.,citizens celebs who became americans in 2008 heidi klum birthplace : germany sworn in : october alan cumming birthplace : scotland sworn in : nov. 4 craig ferguson birthplace : scotland sworn in : feb. 1 ashleigh banfield birthplace : canada sworn in : oct. 24 the superteen miley cyrus it was a year of ups ,citizens celebs who became americans in 2008 heidi klum birthplace : germany sworn in : october alan cumming birthplace : scotland sworn in : nov. 4 craig ferguson birthplace : scotland sworn in : feb. 1 ashleigh banfield birthplace : canada sworn in : oct. 24 the superteen miley cyrus it was a year of,675,tensor(12.4193),the,age,blood,war,the,the,service,grace,hard,trial,war,the,failure,the,the,glory,the
2007,22789,radio,<p> many in radio,<p> many in,1996,tensor(12.4164),the,the,the,the,the,the,the,the,the,the,the,the,the,the,the,the,the
373,1784,2004,"instead of adding to the noise , i broke the one law of foo camp 2004","instead of adding to the noise , i broke the one law of foo camp",1336,tensor(12.3793),",",",",",",",",",",",",",",",",.,",",",",.,.,.,.,",",","
1910,15444,programs,gaunt UNK programs,gaunt UNK,1718,tensor(12.2812),",",",",the,",",",",",",",",",",",",",",the,",",.,",",",",",",","
2086,24754,radio,"maybe they would think we 're a new kind of odd , radio","maybe they would think we 're a new kind of odd ,",1996,tensor(12.0966),and,"""",old,ugly,and,and,and,"""",if,"""",and,"""","""",but,"""",but,""""
1364,13872,online,"you might be on sir edmund hillary , golden monkey , or yeti or any of the other everest-themed names that lonie , being lonie , randomly plucked from online","you might be on sir edmund hillary , golden monkey , or yeti or any of the other everest-themed names that lonie , being lonie , randomly plucked from",1285,tensor(12.0863),the,the,the,the,the,the,the,the,the,the,the,the,the,the,the,the,the
364,2080,2004,"villanueva graduated in 2001 from pasadena high school , and received an associate degree in 2004","villanueva graduated in 2001 from pasadena high school , and received an associate degree in",1336,tensor(12.0403),the,the,the,the,the,the,the,the,the,the,the,the,the,the,the,the,education
2061,23842,radio,<p> he was a brawny wise guy wearing a vinyl jacket and carrying a bag from radio,<p> he was a brawny wise guy wearing a vinyl jacket and carrying a bag from,1996,tensor(12.0387),the,the,the,his,his,his,the,the,the,his,his,his,a,a,a,a,his
143,8923,2001,jama 2001,jama,1597,tensor(12.0261),",",",",",",",",",",",",",",",",",",",",",",",",",",",",",",",",","
2318,22650,u.s.,they were determined not to suffer another uss ,they were determined not to suffer another,675,tensor(11.9772),",",",",to,day,.,word,from,.,blow,attack,loss,war,moment,death,blow,stroke,one
2044,23568,radio,in 1954 only radio,in 1954 only,1996,tensor(11.9651),",",one,a,",",the,a,a,a,3@@,a,the,a,a,a,in,a,a
652,997,basketball,"when i was little , i slept with my basketball","when i was little , i slept with my",1031,tensor(11.9365),mother,father,mother,own,mother,mother,head,mother,mother,head,mother,wife,head,father,mother,mother,father
1236,36467,okay,no more blind dates okay,no more blind dates,2571,tensor(11.9170),of,",",",",than,than,than,from,",",than,.,.,.,.,.,.,.,.
1988,16198,programs,"this particular "" watchable wildlife , "" like the boon in whale-watching tours and even programs","this particular "" watchable wildlife , "" like the boon in whale-watching tours and even",1718,tensor(11.9104),the,the,the,of,the,the,in,the,the,in,the,the,the,the,the,the,the
1528,7219,parking,"mike baughman , assistant pastor , youth ministries , first united methodist church , somerville , new jersey <p> on expectations of youth pastors : <p> most youth ministries that i 've seen are vastly undercapitalized financially and in UNK pastors work with unclear job expectations-other than that their parking","mike baughman , assistant pastor , youth ministries , first united methodist church , somerville , new jersey <p> on expectations of youth pastors : <p> most youth ministries that i 've seen are vastly undercapitalized financially and in UNK pastors work with unclear job expectations-other than that their",1156,tensor(11.8976),own,own,own,own,children,fathers,religious,own,work,own,work,own,own,children,parents,own,own
2373,22260,u.s.,main gate - night 39 calvin looks anxious as the door mechanism scans her u.s.,main gate - night 39 calvin looks anxious as the door mechanism scans her,675,tensor(11.6735),.,way,way,.,.,window,heart,door,way,.,.,face,.,.,.,.,room
2226,20557,television,"fortunately for me , "" he tells the woman from extra , who has been oohing on camera over his success , "" i 'm in this unique business of not singing , not dancing , not performing-just kind of being there .... "" suddenly it 's clear who and what ryan seacrest is : chance-chauncey gardiner , jerzy kosinski 's passive , sexless , tube-addicted cipher , whose own tv debut in being there finds him "" drained of thought , engaged , yet removed .... television","fortunately for me , "" he tells the woman from extra , who has been oohing on camera over his success , "" i 'm in this unique business of not singing , not dancing , not performing-just kind of being there .... "" suddenly it 's clear who and what ryan seacrest is : chance-chauncey gardiner , jerzy kosinski 's passive , sexless , tube-addicted cipher , whose own tv debut in being there finds him "" drained of thought , engaged , yet removed ....",1897,tensor(11.6522),"""",what,"""","""","""","""","""","""","""","""","""","""","""","""","""","""",""""
856,11989,environmental,her heliophobic skin glowed as if moonlit in the blue light of the cabin 's environmental,her heliophobic skin glowed as if moonlit in the blue light of the cabin 's,1277,tensor(11.6248),edge,eye,chamber,lamp,fire,morning,blaze,rays,lamps,cabin,light,light,dark,fire,edge,interior,light
1911,15701,programs,<p> programs,<p>,1718,tensor(11.5832),as,.,tu@@,to@@,is,que,i,ed,.,the,<p>,the,the,the,the,<p>,""""
106,8757,2001,"<p> contributing : zafar m. sheikh the musharraf file <p> age : 62 ; born aug. 11 , 1943 , in new delhi <p> family : wife , sehba ; son , bilal ; daughter , ayla ; four grandchildren <p> education : graduate of command and staff college in quetta , pakistan , and pakistan 's national defense college ; attended royal college of defense studies in britain <p> career : <p> 1961 : joins the pakistan military academy <p> 1964 : commissioned in an elite artillery regiment <p> 1965 , 1971 : participates in wars against india <p> UNK committee ; suspends constitution and assumes title of chief executive after military takeover <p> 2000 : pakistan 's supreme court unanimously validates coup and grants musharraf executive and legislative authority for three years <p> 2001","<p> contributing : zafar m. sheikh the musharraf file <p> age : 62 ; born aug. 11 , 1943 , in new delhi <p> family : wife , sehba ; son , bilal ; daughter , ayla ; four grandchildren <p> education : graduate of command and staff college in quetta , pakistan , and pakistan 's national defense college ; attended royal college of defense studies in britain <p> career : <p> 1961 : joins the pakistan military academy <p> 1964 : commissioned in an elite artillery regiment <p> 1965 , 1971 : participates in wars against india <p> UNK committee ; suspends constitution and assumes title of chief executive after military takeover <p> 2000 : pakistan 's supreme court unanimously validates coup and grants musharraf executive and legislative authority for three years <p>",1597,tensor(11.5786),the,academy,.,town,of,",",s.,.@@,.,of,the,of,of,;,;,the,of
2150,13028,sidebar,"during the depression , fdr 's voice rallied a stricken nation : "" we have nothing to enjoy but pamela an sidebar","during the depression , fdr 's voice rallied a stricken nation : "" we have nothing to enjoy but pamela an",681,tensor(11.5759),'s,hour,and,",",hour,air,island,',',',.,hour,',',',old,un@@
1095,3030,iraqi,and if i continued to suborn iraqi,and if i continued to suborn,835,tensor(11.5735),my,my,my,the,",",the,the,with,the,it,",",it,him,",",",",my,","
1243,36997,okay,"chris oswald , medford , or the flapjack flap okay","chris oswald , medford , or the flapjack flap",2571,tensor(11.5717),of,of,",",",",",",",",of,of,",",.,of,.,.,",",",",",",","
1472,31894,onto,"in an era when the public is concerned both with a loss of freedom to technology and with a fear of consistently finding themselves out of touch with the latest technological developments , there is a transference of our greatest fears about technology onto","in an era when the public is concerned both with a loss of freedom to technology and with a fear of consistently finding themselves out of touch with the latest technological developments , there is a transference of our greatest fears about technology",3937,tensor(11.5634),",",.,",",",",and,.,.,",",",",and,and,.,.,.,and,",",.
1566,6773,parking,we ca n't keep parking,we ca n't keep,1156,tensor(11.5525),the,the,it,it,it,it,the,away,the,you,it,you,up,it,the,up,the
1320,14095,online,"after king struck out with the relief organizations , he began looking online","after king struck out with the relief organizations , he began looking",1285,tensor(11.4672),at,at,at,at,at,about,at,for,for,for,for,for,for,for,for,for,for
1559,6299,parking,ian decker had never received so much as a parking,ian decker had never received so much as a,1156,tensor(11.4453),single,blow,new,man,child,few,hint,glance,di@@,letter,single,single,few,hint,letter,letter,glance
2323,22568,u.s.,"fritz was too tall for his trousers , disheveled , a halo of amber curls framing his face , and he spoke with a young person 's certitude that grown-ups ","fritz was too tall for his trousers , disheveled , a halo of amber curls framing his face , and he spoke with a young person 's certitude that grown",675,tensor(11.4233),up,up,upon,up,up,in,into,with,up,in,up,up,in,up,up,up,up
1828,27594,program,the full title is the working with industry program,the full title is the working with industry,3642,tensor(11.3927),and,",",",",",",.,.,.,.,.,",",.,.,.,.,.,.,and
297,11275,2002,"women 's rights and , by most measures , freedom , are the lowest in the world in arab societies , according to the united nations ' arab human development report 2002","women 's rights and , by most measures , freedom , are the lowest in the world in arab societies , according to the united nations ' arab human development report",1440,tensor(11.3887),",",of,.,",",",",",",is,.,.,",",.,.,.,.,.,.,.
1396,14446,online,"but there had been nothing extraordinary about the pda , no online","but there had been nothing extraordinary about the pda , no",1285,tensor(11.3845),one,doubt,doubt,doubt,matter,doubt,doubt,doubt,matter,one,such,matter,doubt,more,mention,doubt,matter
1724,37472,photo,"but since taking that business class , he has increased his monthly photo","but since taking that business class , he has increased his monthly",2780,tensor(11.3590),wages,income,salary,income,allowance,salary,income,earnings,income,salary,salary,production,salary,salary,salary,salary,salary
214,10776,2002,two separate 2002,two separate,1440,tensor(11.3544),bodies,parties,states,states,sets,rivers,states,rooms,parts,groups,units,ways,ways,events,and,and,groups
628,965,basketball,"<p> graham starts by talking about his own life experiences , how basketball","<p> graham starts by talking about his own life experiences , how",1031,tensor(11.3357),many,much,he,he,much,he,he,he,he,he,he,he,he,he,he,he,he
191,10061,2001,"i was most captivated , however , by finding harrison 's 2001","i was most captivated , however , by finding harrison 's",1597,tensor(11.3265),men,body,residence,name,division,position,nomination,"""",name,father,first,own,name,name,body,own,way
2332,22377,u.s.,<p> but ups ,<p> but,675,tensor(11.3249),",",no,the,",",",",",",",",the,i,the,the,the,the,the,the,the,the
1163,25368,movie,in spite of her movie,in spite of her,2412,tensor(11.3146),own,own,own,fears,own,weakness,own,own,own,own,own,natural,own,own,own,own,own
1368,14142,online,"<p> "" what we 're doing reminds me of the early days of the online","<p> "" what we 're doing reminds me of the early days of the",1285,tensor(11.2869),day,old,old,year,year,old,war,civil,"""",war,year,war,revolution,new,first,war,war
137,8964,2001,"<p> donnie darko <p> a teen-angst science- fiction movie that actually deserves the tag "" cult classic , "" this 2001","<p> donnie darko <p> a teen-angst science- fiction movie that actually deserves the tag "" cult classic , "" this",1597,tensor(11.2861),is,is,"""",is,is,is,is,is,is,time,is,is,is,week,is,is,film
452,4680,anymore,<p> but anymore,<p> but,1565,tensor(11.2751),",",no,the,",",",",",",",",the,i,the,the,the,the,the,the,the,the
1300,13920,online,"he was quickly drawn in , spending entire days in front of his computer , UNK he found online","he was quickly drawn in , spending entire days in front of his computer , UNK he found",1285,tensor(11.2487),himself,himself,himself,that,himself,himself,himself,himself,himself,that,that,a,a,that,that,the,a
2308,22346,u.s.,other ups ,other,675,tensor(11.2412),",",",",",",",",.,",",side,.,",",.,",",.,.,",",",",.,people
611,279,basketball,playskool basketball,playskool,1031,tensor(11.1595),",",",",s-@@,",",",",",",",",",",",",",",",",",",",",.,.,',","
1862,28903,program,<p> market research <p> when kygo program,<p> market research <p> when kygo,3642,tensor(11.1566),",",was,was,",",",",to,to,to,",",&;,",",went,is,'s,was,and,gets
855,11645,environmental,"in this sense , the collective judgments and synthetic interpretations made in interdisciplinary environmental","in this sense , the collective judgments and synthetic interpretations made in interdisciplinary",1277,tensor(11.1521),cases,language,cases,language,order,science,and,terms,circles,and,terms,and,terms,systems,studies,terms,cases
674,406,basketball,i hope for the sake of basketball,i hope for the sake of,1031,tensor(11.1396),the,the,the,the,the,your,the,the,the,the,the,my,the,the,the,the,the
1545,6208,parking,"my mother had died ; linden was not doing very well , as i explained to you , and here i was , pregnant with a husband who considered adultery less important than a parking","my mother had died ; linden was not doing very well , as i explained to you , and here i was , pregnant with a husband who considered adultery less important than a",1156,tensor(11.1396),brother,marriage,jew,crime,woman,woman,crime,man,wife,husband,wife,child,woman,man,wife,woman,man
2004,24203,radio,my loader opened up and shot one of our radio,my loader opened up and shot one of our,1996,tensor(11.1306),men,horses,guns,men,horses,men,men,ponies,boys,men,soldiers,men,boys,men,men,men,own
2131,12990,sidebar,"summaries of more than 1,200 sidebar","summaries of more than 1,200",681,tensor(11.1208),tons,square,pages,men,persons,pounds,feet,men,persons,persons,persons,persons,miles,million,pages,persons,students
83,8213,1999,error bars UNK mowitt 1999,error bars UNK mowitt,1211,tensor(11.0776),",",",",",",of,.,",",",",",",'s,",",",",'s,",",",",",",",",","
2148,13015,sidebar,as sunlight sidebar,as sunlight,681,tensor(11.0479),",",",",",",",",",",",",",",.,",",",",",",",",.,",",",",rose,","
2362,22546,u.s.,dethroned miss california u.s.,dethroned miss california,675,tensor(11.0439),",",",",",",",",.,",",",",",",'s,.,",",",",'s,",",.,'s,'s
1334,14488,online,that 's it for me and online,that 's it for me and,1285,tensor(11.0329),my,i,you,for,my,for,for,for,i,i,you,you,you,for,i,the,for
1026,3088,iraqi,<p> studying religion in school <p> iraqi,<p> studying religion in school <p>,835,tensor(11.0236),.,.,it,is,is,aries,s-@@,.@@,.,the,dr.,sirs,sir,sir,the,the,the
61,7374,1999,<p> what you might <p> have missed UNK 1999,<p> what you might <p> have missed UNK,1211,tensor(11.0231),",",",",",",",",",",",",",",",",",",.,<p>,",",<p>,<p>,.,.,","
304,2068,2004,"1-3 , and maranao man , all 2004","1-3 , and maranao man , all",1336,tensor(11.0016),the,the,the,the,of,of,of,of,of,of,of,of,of,of,of,of,of
688,261,basketball,"why , given my constant struggling and juggling to fit a busy schedule into days without enough hours , does basketball","why , given my constant struggling and juggling to fit a busy schedule into days without enough hours , does",1031,tensor(10.9996),not,not,not,not,n't,not,not,n't,n't,n't,n't,not,n't,not,n't,n't,it
1176,25416,movie,""" go to parties with movie",""" go to parties with",2412,tensor(10.9980),you,you,the,me,you,you,the,you,the,you,the,me,me,the,the,the,the
2128,13410,sidebar,i showed them that artforum sidebar,i showed them that artforum,681,tensor(10.9137),was,was,was,was,was,was,was,and,",",was,",",",",",",",",was,was,was
269,10675,2002,"but for some important facts , i will use figures from 2002","but for some important facts , i will use figures from",1440,tensor(10.9098),the,the,the,the,the,the,the,the,the,the,the,the,the,the,the,the,the
1143,25197,movie,they did n't understand movie,they did n't understand,2412,tensor(10.8867),the,me,it,me,",",",",it,what,.,.,.,.,.,.,.,.,.
1568,6137,parking,"but i can also claim employment as night watchman , parking","but i can also claim employment as night watchman ,",1156,tensor(10.8831),and,and,and,who,and,and,and,and,who,and,and,and,and,and,and,"""",a
1,7768,1999,but the team went to the rock with confidence born of burton 's 1999,but the team went to the rock with confidence born of burton 's,1211,tensor(10.8803),friend,art,",",",",",",love,.,"""",ability,determination,.,father,ability,own,father,.,own
1626,42570,phone,"the hacker imagination , like the literature that it is akin to , is rooted in something much deeper than microchips , phone","the hacker imagination , like the literature that it is akin to , is rooted in something much deeper than microchips ,",4790,tensor(10.8236),and,and,and,and,and,and,and,and,and,and,and,and,which,and,and,which,and
1114,25530,movie,i 'm talking to movie,i 'm talking to,2412,tensor(10.7980),you,you,you,you,you,you,you,you,you,you,you,you,you,you,you,you,you
1660,44661,phone,"there were lots of shrubs and short trees , but very few of any size , although quite a number of dead ones poked up like broken phone","there were lots of shrubs and short trees , but very few of any size , although quite a number of dead ones poked up like broken",4790,tensor(10.7864),stones,leaves,trees,leaves,trees,logs,pieces,stones,flowers,stones,flowers,bones,glass,leaves,leaves,bones,stones
595,3546,atlanta,"<p> over the years , or rather , over the decades , atlanta","<p> over the years , or rather , over the decades ,",1360,tensor(10.7745),and,and,which,and,of,and,of,the,when,have,the,the,the,the,the,the,the
2109,12964,sidebar,"the applications are sitting on every desktop , and they all have known vulnerabilities , "" says andrew sidebar","the applications are sitting on every desktop , and they all have known vulnerabilities , "" says andrew",681,tensor(10.7732),jackson,jackson,",",johnson,.,jackson,johnson,carnegie,.,.,johnson,warren,.,b.,j.,c.,m.
1912,15098,programs,csiro entomology researcher melissa piper programs,csiro entomology researcher melissa piper,1718,tensor(10.7496),",",.,.,",",",",",",.,",",",",",",",",",",",",",",",",",",","
1504,6173,parking,barry glanced up and saw the doughy young cop who 'd been directing parking,barry glanced up and saw the doughy young cop who 'd been directing,1156,tensor(10.7377),his,his,the,the,him,the,him,the,the,the,the,the,the,the,the,the,him
2067,24334,radio,at radio,at,1996,tensor(10.7308),the,the,the,the,the,the,the,the,the,the,the,the,the,the,the,the,the
1353,14412,online,if zeke was n't online,if zeke was n't,1285,tensor(10.7105),a,a,a,a,a,a,there,a,a,going,a,there,here,there,there,in,there
1722,37814,photo,137 the best photo,137 the best,2780,tensor(10.6764),of,edition,of,way,and,of,work,of,of,of,way,of,part,of,of,of,of
11,7907,1999,his 1999,his,1211,tensor(10.6611),own,own,own,own,own,own,own,own,own,own,own,eyes,head,own,own,own,head
1590,7163,parking,the senator greeted him at the door with a parking,the senator greeted him at the door with a,1156,tensor(10.6061),look,smile,look,smile,smile,smile,smile,smile,smile,smile,smile,smile,smile,smile,smile,grin,sigh
329,1986,2004,his 2004,his,1336,tensor(10.5849),own,own,own,own,own,own,own,own,own,own,own,eyes,head,own,own,own,head
1192,26988,movie,with a movie,with a,2412,tensor(10.5767),smile,smile,view,smile,smile,smile,great,little,little,smile,single,little,little,new,new,few,few
1043,3020,iraqi,washington 's favorite iraqi,washington 's favorite,835,tensor(10.5659),history,",",",",",",resort,",",theme,",",",",of,son,",",target,hotel,newspaper,",",place
