level_0,index,word,sentence,context,wc,surprisal,top_pred_1830,top_pred_1840,top_pred_1850,top_pred_1860,top_pred_1870,top_pred_1880,top_pred_1890,top_pred_1900,top_pred_1910,top_pred_1920,top_pred_1930,top_pred_1940,top_pred_1950,top_pred_1960,top_pred_1970,top_pred_1980,top_pred_1990
565,3465,atlanta,"<p> drive through buckhead , midtown and downtown these days , and you 'll notice atlanta","<p> drive through buckhead , midtown and downtown these days , and you 'll notice",1360,tensor(9.2926),the,the,the,how,them,that,that,that,that,that,that,that,that,that,that,that,the
555,4109,atlanta,when we uprooted her from atlanta,when we uprooted her from,1360,tensor(9.2663),the,the,the,the,the,the,the,the,the,the,the,the,the,the,the,the,the
1213,34941,okay,and which is okay,and which is,2571,tensor(9.2016),the,the,not,the,the,the,the,the,the,the,the,the,the,the,the,a,why
1415,32434,onto,"in factories across the country , women painted luminous faces onto","in factories across the country , women painted luminous faces",3937,tensor(9.1925),",",",",",",",",",",",",",",",",",",",",and,",",",",",",",",",",","
1686,41677,phone,"<p> <p> this three-pronged congruence of players and events the sudden availability of someone to work the department 's cold files , the discovery of this body though it was not likely related , and the phone","<p> <p> this three-pronged congruence of players and events the sudden availability of someone to work the department 's cold files , the discovery of this body though it was not likely related , and the",4790,tensor(9.1365),whole,story,whole,result,absence,fact,result,discovery,fact,fact,discovery,fact,fact,performance,fact,fact,fact
1790,38011,photo,his days had been crammed with photo,his days had been crammed with,2780,tensor(9.1087),the,the,the,the,the,",",the,the,the,the,the,the,the,the,the,the,books
1887,27939,program,but the nut element still would not leave our program,but the nut element still would not leave our,3642,tensor(9.1062),eyes,bones,heads,ears,path,lips,field,own,shores,eyes,house,minds,hands,city,eyes,house,house
73,8062,1999,<p> the only official statement from a medical organization the article quotes is the 1999,<p> the only official statement from a medical organization the article quotes is the,1211,tensor(8.9990),most,following,following,most,statement,following,following,statement,following,report,fact,fact,fact,"""",fact,fact,fact
1717,37962,photo,sidebar photo,sidebar,2780,tensor(8.9966),",",",",",",",",",",",",",",",",",",",",",",",",",",",",",",",",the
1600,43746,phone,"<p> taking a deep breath , selonnah repeated , "" that phone","<p> taking a deep breath , selonnah repeated , "" that",4790,tensor(8.9717),is,is,i,'s,the,'s,'s,'s,'s,'s,'s,'s,'s,'s,'s,'s,'s
354,1407,2004,// the 2004,// the,1336,tensor(8.9535),most,same,whole,way,most,most,most,same,first,first,first,united,first,first,first,most,most
1423,31571,onto,"<p> sitges , spain - the road , followed far enough , slopes onto","<p> sitges , spain - the road , followed far enough , slopes",3937,tensor(8.8194),into,",",",",of,of,",",of,of,",",of,of,and,of,",",of,",",to
1804,28056,program,with the village jobs program,with the village jobs,3642,tensor(8.8111),",",",",",",",",",",",",",",",",.,",",.,.,.,.,",",",",.
203,10102,2002,<p> 2002,<p>,1440,tensor(8.8037),as,.,tu@@,to@@,is,que,i,ed,.,the,<p>,the,the,the,the,<p>,""""
87,7947,1999,"try "" bobby labonte 's 1999","try "" bobby labonte 's",1211,tensor(8.7827),"""",",",new,",","""","""","""","""","""","""","""","""","""","""","""","""",""""
1627,42278,phone,he may have wanted her phone,he may have wanted her,4790,tensor(8.7748),to,",",.,",",.,to,to,to,to,.,to,to,to,to,to,to,to
1797,38842,photo,at least you get to choose the photo,at least you get to choose the,2780,tensor(8.7720),president,next,same,best,best,best,best,place,best,one,right,truth,way,truth,best,best,right
1675,40517,phone,"fogg-smythers , "" he said , frosting my phone","fogg-smythers , "" he said , frosting my",4790,tensor(8.6832),head,hand,fingers,hair,hand,hair,hand,heels,forehead,tongue,hand,hand,arm,face,hand,face,face
1856,30111,program,there was almost no news coverage until stories began to UNK program,there was almost no news coverage until stories began to UNK,3642,tensor(8.6390),",",",",the,",",the,",",the,the,",",",",the,the,the,the,the,the,the
496,4749,anymore,"not a thing to be proud of , but it was all you could do anymore","not a thing to be proud of , but it was all you could do",1565,tensor(8.6388),.,.,",",to,for,.,to,to,to,to,.,to,to,to,.,.,to
127,8898,2001,"<p> "" the fact that smarty jones is not a kentucky-bred is important because it shows again UNK once were , "" said jim squires , who bred the 2001","<p> "" the fact that smarty jones is not a kentucky-bred is important because it shows again UNK once were , "" said jim squires , who bred the",1597,tensor(8.6385),pistol,liquor,old,horse,old,habit,little,best,most,same,best,idea,best,first,most,team,team
1417,32881,onto,"<p> <p> no longer groggy , UNK onto","<p> <p> no longer groggy , UNK",3937,tensor(8.5369),",",",",",",",",",",",",",",",",the,",",<p>,.,<p>,<p>,.,the,","
79,8465,1999,<p> the white wines run the gamut from the 1999,<p> the white wines run the gamut from the,1211,tensor(8.4894),"""",french,lips,windows,ground,wall,rhine,white,white,white,south,city,lips,white,can@@,white,top
198,9901,2001,exploring the surface will require a better spacesuit than the one i used as an astronaut to help assemble the iss in 2001,exploring the surface will require a better spacesuit than the one i used as an astronaut to help assemble the iss in,1597,tensor(8.4881),the,the,the,the,the,the,the,the,the,the,the,the,the,the,the,the,the
491,5127,anymore,"when old age stole over him , when he was too weak to hustle in the market anymore","when old age stole over him , when he was too weak to hustle in the market",1565,tensor(8.4627),",",",",",",",",.,",",",",for,.,",",.,.,.,",",.,",",.
1427,33921,onto,elaine 's father enters the room and asks if the girls are enjoying the parade they have been watching : UNK onto,elaine 's father enters the room and asks if the girls are enjoying the parade they have been watching : UNK,3937,tensor(8.4522),",",",",",",",",",",the,",",",",",",the,.,.,",",.,the,",",","
1422,31819,onto,"it 's a gold necklace , and if you 'd be so foolhardy as to carry it with you onto","it 's a gold necklace , and if you 'd be so foolhardy as to carry it with you",3937,tensor(8.3596),",",",",",",",",",",",",",",",",",",",",",",",",",",",",",",",",","
1894,28493,program,it was a neighborhood program,it was a neighborhood,3642,tensor(8.3281),of,of,",",of,of,",",of,of,of,where,town,town,neighborhood,of,of,of,of
469,5093,anymore,"learn this truth again , differently , the same truth and a different truth as a veteran observing the action you can barely keep up with anymore and shouldnt even be trying to keep up with anymore","learn this truth again , differently , the same truth and a different truth as a veteran observing the action you can barely keep up with anymore and shouldnt even be trying to keep up with",1565,tensor(8.2605),the,the,the,the,your,the,the,the,the,the,.,it,it,it,it,it,it
1464,32293,onto,she started onto,she started,3937,tensor(8.2222),",",",",",",",",up,up,",",to,to,to,to,to,to,to,to,to,to
192,8906,2001,"<p> he dismissed age as a reason for the yankees ' plight , citing the 2001","<p> he dismissed age as a reason for the yankees ' plight , citing the",1597,tensor(8.0925),idea,whole,governor,rebels,fact,same,name,failure,whole,fact,fact,fact,fact,"""",fact,"""",fact
114,9102,2001,"then , at a baby shower for his niece in 2001","then , at a baby shower for his niece in",1597,tensor(8.0837),the,the,the,the,the,the,the,the,the,the,the,the,a,the,the,the,the
497,4763,anymore,he vowed not to bait her anymore,he vowed not to bait her,1565,tensor(8.0772),",",with,",",.,.,",",.,.,.,.,.,.,.,.,.,.,.
1492,32558,onto,steve looks at robert and flings himself in the air and onto,steve looks at robert and flings himself in the air and,3937,tensor(8.0660),the,looks,says,sees,goes,looks,says,then,says,says,starts,starts,waves,runs,says,then,says
136,8893,2001,"norton antivirus , which we found far more stable than the other programs in systemworks 2001","norton antivirus , which we found far more stable than the other programs in systemworks",1597,tensor(7.9007),.,",",",",.,.,.,of,.,",",.,.,.,.,.,.,.,.
436,4936,anymore,physical force is simply not acceptable anymore,physical force is simply not acceptable,1565,tensor(7.7816),to,to,to,to,to,to,to,to,to,to,to,to,to,to,.,.,.
734,16630,billion,he imagines that the last billion,he imagines that the last,2039,tensor(7.7751),of,words,of,of,part,of,thing,of,of,two,word,word,of,thing,time,of,thing
1476,31120,onto,"<p> meanwhile , the first one to race onto","<p> meanwhile , the first one to race",3937,tensor(7.5882),",",",",",",",",",",",",",",with,",",the,was,the,the,for,the,in,the
726,18402,billion,"- owned myspace , which boasts more UNK billion","- owned myspace , which boasts more UNK",2039,tensor(7.4967),",",",",the,",",the,",",",",",",the,the,",",",",",",the,",",the,","
791,18480,billion,"it'sjust what you find at the extreme right edge of the bell curve , the one you 'd get if six billion","it'sjust what you find at the extreme right edge of the bell curve , the one you 'd get if six",2039,tensor(7.1066),of,feet,would,feet,or,or,feet,hundred,of,or,feet,or,or,hundred,or,or,or
703,17977,billion,nearly as many-one and a half billion,nearly as many-one and a half,2039,tensor(6.6514),of,of,foot,",",as,as,as,dozen,as,",",million,.,years,",",times,years,.
744,17417,billion,in this city of one hundred billion,in this city of one hundred,2039,tensor(6.6355),and,and,and,and,and,and,and,and,and,and,and,and,and,million,and,thousand,and
769,18509,billion,"designated 1e 0657-56 , the object , about 3 billion","designated 1e 0657-56 , the object , about 3",2039,tensor(6.0677),per,inches,o'clock,years,per,miles,per,",",per,",",miles,per,in.,',inches,",",inches
700,17928,billion,it has taken only ten years to connect the next billion,it has taken only ten years to connect the next,2039,tensor(6.0477),two,with,two,two,two,two,ten,two,two,two,two,two,two,two,two,two,generation
727,17264,billion,consuming 45 billion,consuming 45,2039,tensor(5.7291),",",per,",",",",per,hours,',per,per,per,",",million,minutes,per,million,million,percent
774,18091,billion,at 4 billion,at 4,2039,tensor(5.6595),o'clock,cents,o'clock,o'clock,a.m.,o'clock,o'clock,o'clock,o'clock,o'clock,p.,p.,p.,p.,a.m.,:,p.m.
